{
  "schema_version": "2",
  "record_kind": "execution result",
  "result_id": "claude-discovery-focused-01-invocation-comments-description-existing-1-1-assessment",
  "assessed_at": "2026-10-21T17:01:57.834413+00:00",
  "run_id": "20261021T170100634Z-cw-focused-claude-invocation-comments-description-existing-39ebc29c-b517-45c5-acfb-82a12f8a67ee-a945a3l_",
  "condition": "description-existing",
  "assessor": {
    "name": "Codex active session",
    "method": "active session",
    "model": null,
    "session_id": null,
    "context": "Same Codex controller authored/reviewed exposed development variants and directly judged complete outputs; no blind, held-out or independent assessor claim. Separate Opus review supplements this."
  },
  "manifest": {
    "path": "skill-studies/concise-writing/runs/revised-body-discovery-01/preparation/manifests/claude-invocation-comments-manifest.json",
    "sha256": "e6a59916bba8ee1781ebc80fa43f0239272e12f47cb5548090be72afb385eb71",
    "version": "1",
    "git_revision": "62d530fb2f5ca36f5c7b70e3e84f42a77f1f0f22"
  },
  "evidence": [
    {
      "id": "output",
      "artifact": {
        "path": "/Users/simon/work/personal/skill-study-private/concise-writing/revised-body-discovery-20261018/subjects/20261021T170100634Z-cw-focused-claude-invocation-comments-description-existing-39ebc29c-b517-45c5-acfb-82a12f8a67ee-a945a3l_/workspace/fixture/uploader.py",
        "sha256": "e89e3ced16876ca5daf8596bcaff51b3532a9435b76791c0198ac42a637fbcb9",
        "version": null
      },
      "selector": "Complete artifact"
    },
    {
      "id": "trace",
      "artifact": {
        "path": "/Users/simon/work/personal/skill-study-private/concise-writing/revised-body-discovery-20261018/subjects/20261021T170100634Z-cw-focused-claude-invocation-comments-description-existing-39ebc29c-b517-45c5-acfb-82a12f8a67ee-a945a3l_/stdout.txt",
        "sha256": "0daac110d7201edf67771fc149538b16e2e85a30384a10e6c85262f09a19015f",
        "version": null
      },
      "selector": "Complete artifact"
    },
    {
      "id": "mechanical",
      "artifact": {
        "path": "/Users/simon/work/personal/skill-study-private/concise-writing/revised-body-discovery-20261018/subjects/20261021T170100634Z-cw-focused-claude-invocation-comments-description-existing-39ebc29c-b517-45c5-acfb-82a12f8a67ee-a945a3l_/result.json",
        "sha256": "98ba7630587006e6472403c2dcbfe36fd0c75e3255f439e969f8cdb34d018ea5",
        "version": null
      },
      "selector": "Complete artifact"
    },
    {
      "id": "log",
      "artifact": {
        "path": "/Users/simon/work/personal/skill-study-private/concise-writing/revised-body-discovery-20261018/subjects/20261021T170100634Z-cw-focused-claude-invocation-comments-description-existing-39ebc29c-b517-45c5-acfb-82a12f8a67ee-a945a3l_/runner.log",
        "sha256": "4f33876100f3efeed5049b6af77065b623aebc891196cafe4d9b01a23b41f6f5",
        "version": null
      },
      "selector": "Complete artifact"
    },
    {
      "id": "final",
      "artifact": {
        "path": "/Users/simon/work/personal/skill-study-private/concise-writing/revised-body-discovery-20261018/subjects/20261021T170100634Z-cw-focused-claude-invocation-comments-description-existing-39ebc29c-b517-45c5-acfb-82a12f8a67ee-a945a3l_/final.txt",
        "sha256": "b9999fd4086bb941f1e680521c51bfad4559b63454f9db28e504fe019ebc7379",
        "version": null
      },
      "selector": "Complete artifact"
    },
    {
      "id": "source-0",
      "artifact": {
        "path": "skill-studies/concise-writing/cases/invocation-comments/task.md",
        "sha256": "6a771f7383d14f7d77b02c862155da0b10af1e83cc72333512c5a83fde9523b5",
        "version": null,
        "git_revision": "835a41fab005d537ee34c8bb9f056409678fa3cc"
      },
      "selector": "Complete frozen TASK.md"
    },
    {
      "id": "source-1",
      "artifact": {
        "path": "skill-studies/concise-writing/cases/invocation-comments/fixture/uploader.py",
        "sha256": "2587771c1d7fee7e2ca72dbb1ff1a2594fff69775a72fff1929f437cce8ec2f1",
        "version": null,
        "git_revision": "835a41fab005d537ee34c8bb9f056409678fa3cc"
      },
      "selector": "Complete frozen uploader.py"
    },
    {
      "id": "source-2",
      "artifact": {
        "path": "skill-studies/concise-writing/cases/invocation-comments/fixture/MAINTAINER-NOTES.md",
        "sha256": "59175ed2990a8b65636507ce2116321e70c60b1c0a2eea288d01e075252fc847",
        "version": null,
        "git_revision": "835a41fab005d537ee34c8bb9f056409678fa3cc"
      },
      "selector": "Complete frozen MAINTAINER-NOTES.md"
    },
    {
      "id": "catalog-qualification",
      "artifact": {
        "path": "/Users/simon/work/personal/skill-study-private/concise-writing/revised-body-discovery-20261018/qualification-20261021/catalog-existing/claude-catalog-existing-workspace-write/requests.json",
        "sha256": "1393f29d6d4e0d6a0bc26c7f1d62dc0371d78dca347c2182c50571d6fdf99e24",
        "version": null
      },
      "selector": "Retained exact-description initial request without body and subsequent complete-body delivery; actual live init separately lists CW and Skill."
    },
    {
      "id": "task-mechanical",
      "artifact": {
        "path": "/Users/simon/work/personal/skill-study-private/concise-writing/revised-body-discovery-20261018/mechanical/136.json",
        "sha256": "b3b0685519c03e8269a5501fdd26b0400205021549795c81c192dfda5b69e3d6",
        "version": null
      },
      "selector": "Complete saved parse/token or numeric/reply observation; no subject code execution"
    }
  ],
  "setup": {
    "status": "valid",
    "reason": "Fixed provider/model/CLI and retained inventory verified. Native skill available; complete assigned body before first edit: False; actual init lists CW and Skill; exact description/body separation established by retained byte-matched transport qualification, not echoed in live init. Protected input bytes unchanged.",
    "evidence": [
      "mechanical",
      "trace",
      "log",
      "catalog-qualification"
    ]
  },
  "criteria": [
    {
      "id": "F1",
      "dimension": "functional",
      "judgment": "met",
      "reason": "The complete code/comments accurately preserve initial-plus-three retries, immediate propagation of other send errors, final temporary failure propagation and acknowledgement outside the send handler after acceptance. Even temporary ack errors must not resend because of duplicate risk. Syntax/tokens are unchanged.",
      "consequence": "Required whole-artifact functional factor; length cannot offset failure.",
      "evidence": [
        "output",
        "source-0",
        "source-1",
        "source-2"
      ]
    },
    {
      "id": "F2",
      "dimension": "functional",
      "judgment": "met",
      "reason": "The maintainer can identify the exact budget and error boundary and understand why receipt-recording failures must not resend an accepted batch, including TemporaryUploadError at the acknowledgement site.",
      "consequence": "Required whole-artifact functional factor; length cannot offset failure.",
      "evidence": [
        "output",
        "source-0",
        "source-1",
        "source-2"
      ]
    },
    {
      "id": "F3",
      "dimension": "functional",
      "judgment": "met",
      "reason": "Three comment blocks explain distinct retry, final-attempt and acknowledgement boundaries where they occur. The local budget reinforcement is useful and does not bury the warning or impose consequential reading burden.",
      "consequence": "Required whole-artifact functional factor; length cannot offset failure.",
      "evidence": [
        "output",
        "source-0",
        "source-1",
        "source-2"
      ]
    },
    {
      "id": "D1",
      "dimension": "procedural",
      "judgment": "not met",
      "reason": "With qualified existing-description availability and complete capture, the subject reads task, notes and code and edits comments without invoking Skill or reading a skill file. No full or partial body is delivered at any time: a native miss, not a late load.",
      "consequence": "Selection is reported separately from artifact quality.",
      "evidence": [
        "trace",
        "log",
        "catalog-qualification"
      ]
    }
  ],
  "functional_result": "met",
  "procedural_summary": "Fixed provider/model/CLI and retained inventory verified. Native skill available; complete assigned body before first edit: False; actual init lists CW and Skill; exact description/body separation established by retained byte-matched transport qualification, not echoed in live init. Protected input bytes unchanged. O4/O5 remain unscored; native D1 is distinct from functional outcome.",
  "observations": [
    {
      "dimension": "functional",
      "description": "Complete output 99 wc-w words; supplied TASK.md: 47 words, uploader.py: 48 words, MAINTAINER-NOTES.md: 136 words. Counts describe length, not semantic success; comment-only counts are reported separately for N4.",
      "consequence": "Descriptive counts only.",
      "evidence": [
        "output",
        "source-0",
        "source-1",
        "source-2"
      ]
    },
    {
      "dimension": "functional",
      "description": "66 comment words versus 20 original words give a fuller explanation with an explicit duplicate-upload warning. The artifact succeeds despite the invocation miss, so good comments cannot substitute for D1 evidence.",
      "consequence": "Qualitative comparison is separate from threshold counts.",
      "evidence": [
        "output",
        "source-0",
        "source-1",
        "source-2"
      ]
    }
  ],
  "uncertainty": []
}
