{
  "schema_version": "2",
  "record_kind": "execution result",
  "result_id": "codex-final-handoff-01-long-handoff-revised-body-2-1-assessment",
  "assessed_at": "2026-10-22T19:45:29.457822+00:00",
  "run_id": "20261022T194428548Z-cw-final-codex-long-handoff-revised-body-c5b68e9e-fdfe-4665-8ca8-3b031811b3b9-fnd0hr89",
  "condition": "revised-body",
  "assessor": {
    "name": "Codex active session",
    "method": "active session",
    "model": null,
    "session_id": null,
    "context": "Same Codex controller authored/reviewed exposed development variants and directly judged complete outputs; no blind, held-out or independent assessor claim. Separate Opus review supplements this."
  },
  "manifest": {
    "path": "skill-studies/concise-writing/runs/final-comparison-01/handoff-01/preparation/manifests/codex-long-handoff-manifest.json",
    "sha256": "69bfc027ee125246a5f2c282afa0096d0957a19f8cf3899548da3f006ebfe6a4",
    "version": "1",
    "git_revision": "9cfd0aef9d986542f6e97a54436a090a0394c3f9"
  },
  "evidence": [
    {
      "id": "output",
      "artifact": {
        "path": "/Users/simon/work/personal/skill-study-private/concise-writing/final-comparison-20261022/handoff-01/subjects/20261022T194428548Z-cw-final-codex-long-handoff-revised-body-c5b68e9e-fdfe-4665-8ca8-3b031811b3b9-fnd0hr89/workspace/fixture/report.md",
        "sha256": "b4245ff313498f0451ab4d024ff5bd3a65cdd81d612b151a54931b6d20c147f3",
        "version": null
      },
      "selector": "Complete artifact"
    },
    {
      "id": "trace",
      "artifact": {
        "path": "/Users/simon/work/personal/skill-study-private/concise-writing/final-comparison-20261022/handoff-01/subjects/20261022T194428548Z-cw-final-codex-long-handoff-revised-body-c5b68e9e-fdfe-4665-8ca8-3b031811b3b9-fnd0hr89/provider-session.jsonl",
        "sha256": "331ebbcc560c02301a9aabe492498ce4a387108a1328c24a47ada68fda64a526",
        "version": null
      },
      "selector": "Complete artifact"
    },
    {
      "id": "mechanical",
      "artifact": {
        "path": "/Users/simon/work/personal/skill-study-private/concise-writing/final-comparison-20261022/handoff-01/subjects/20261022T194428548Z-cw-final-codex-long-handoff-revised-body-c5b68e9e-fdfe-4665-8ca8-3b031811b3b9-fnd0hr89/result.json",
        "sha256": "4439072906d200c12f9273a69bc576af609590e95189f4e82cd6bfdb65f1d6f2",
        "version": null
      },
      "selector": "Complete artifact"
    },
    {
      "id": "log",
      "artifact": {
        "path": "/Users/simon/work/personal/skill-study-private/concise-writing/final-comparison-20261022/handoff-01/subjects/20261022T194428548Z-cw-final-codex-long-handoff-revised-body-c5b68e9e-fdfe-4665-8ca8-3b031811b3b9-fnd0hr89/runner.log",
        "sha256": "136d98fef4334076d29d0035dfd9b8b6c9938f2cd0626fc7f97650d2720f069b",
        "version": null
      },
      "selector": "Complete artifact"
    },
    {
      "id": "final",
      "artifact": {
        "path": "/Users/simon/work/personal/skill-study-private/concise-writing/final-comparison-20261022/handoff-01/subjects/20261022T194428548Z-cw-final-codex-long-handoff-revised-body-c5b68e9e-fdfe-4665-8ca8-3b031811b3b9-fnd0hr89/final.txt",
        "sha256": "e0581b525028ed391195100a10320e40c2c0649d8837a1e699a14f7f3c7f2bd3",
        "version": null
      },
      "selector": "Complete artifact"
    },
    {
      "id": "source-0",
      "artifact": {
        "path": "skill-studies/concise-writing/runs/final-comparison-01/preparation/fixtures/long-handoff/report.md",
        "sha256": "0eb0946286d2a4b1708f14bcff5795cd1effdfa64af612a6cb9a89d2fac84737",
        "version": null,
        "git_revision": "88bbee2e0316a2f7fb3120bb9bc241a5f054ae90"
      },
      "selector": "Complete frozen report.md"
    },
    {
      "id": "source-1",
      "artifact": {
        "path": "skill-studies/concise-writing/runs/final-comparison-01/preparation/fixtures/long-handoff/TASK.md",
        "sha256": "8be0f67fe6b62ca0a1d5f3af9ac2ffea79eef0d0615f0979853079653b8feab8",
        "version": null,
        "git_revision": "88bbee2e0316a2f7fb3120bb9bc241a5f054ae90"
      },
      "selector": "Complete frozen TASK.md"
    }
  ],
  "setup": {
    "status": "valid",
    "reason": "Fixed provider/model/CLI and retained inventory verified. Complete assigned teaching body in tool output 16 before first task edit 33. Protected input bytes unchanged.",
    "evidence": [
      "mechanical",
      "trace",
      "log"
    ]
  },
  "criteria": [
    {
      "id": "F1",
      "dimension": "functional",
      "judgment": "met",
      "reason": "The complete report preserves the source facts, staging/rollback limitations, pilot-only approval, all numerical and consecutive-batch boundaries, discrepancy handling, unresolved acknowledgement protections, evidence-release authorization and post-incident approval requirements.",
      "consequence": "Required whole-artifact functional factor; length cannot offset failure.",
      "evidence": [
        "output",
        "source-0",
        "source-1"
      ]
    },
    {
      "id": "F2",
      "dimension": "functional",
      "judgment": "met",
      "reason": "Direct-entry Deployment and Rollback retain necessary prerequisites and causal safeguards. Required saved state, owner escalation, lease token, explicit shift acceptance and the separate next release decision remain usable without reconstructing the deleted opening/reminder.",
      "consequence": "Required whole-artifact functional factor; length cannot offset failure.",
      "evidence": [
        "output",
        "source-0",
        "source-1"
      ]
    },
    {
      "id": "F3",
      "dimension": "functional",
      "judgment": "met",
      "reason": "The edit removes opening filler, the duplicate eighty-export count and detached implementation reminder while maintaining coherent operational headings and focused paragraphs. Remaining local reinforcement of untested conditions adds no demonstrated consequential reading burden.",
      "consequence": "Required whole-artifact functional factor; length cannot offset failure.",
      "evidence": [
        "output",
        "source-0",
        "source-1"
      ]
    }
  ],
  "functional_result": "met",
  "procedural_summary": "Fixed provider/model/CLI and retained inventory verified. Complete assigned teaching body in tool output 16 before first task edit 33. Protected input bytes unchanged. O4/O5 remain unscored; native D1 is distinct from functional outcome.",
  "observations": [
    {
      "dimension": "functional",
      "description": "Complete output 1001 wc-w words; supplied report.md: 1207 words, TASK.md: 68 words. Counts describe length, not semantic success.",
      "consequence": "Descriptive counts only.",
      "evidence": [
        "output",
        "source-0",
        "source-1"
      ]
    },
    {
      "dimension": "functional",
      "description": "1001 words, a conservative edit that preserves more source phrasing than the first original-body output. The mechanism is explained once, with useful recovery safeguards repeated at the Rollback entry point; no substantive deficiency identified.",
      "consequence": "Qualitative comparison is separate from threshold counts.",
      "evidence": [
        "output",
        "source-0",
        "source-1"
      ]
    }
  ],
  "uncertainty": []
}
