{
  "schema_version": "2",
  "record_kind": "execution result",
  "result_id": "codex-body-focused-01-long-handoff-control-2-1-assessment",
  "assessed_at": "2026-10-21T06:38:02.523395+00:00",
  "run_id": "20261021T063626456Z-cw-focused-codex-long-handoff-control-dceae98a-ffb7-4aac-8e6f-6afe9bf13fec-3d3p968x",
  "condition": "control",
  "assessor": {
    "name": "Codex active session",
    "method": "active session",
    "model": null,
    "session_id": null,
    "context": "Same Codex controller authored/reviewed exposed development variants and directly judged complete outputs; no blind, held-out or independent assessor claim. Separate Opus review supplements this."
  },
  "manifest": {
    "path": "skill-studies/concise-writing/runs/revised-body-discovery-01/preparation/manifests/codex-long-handoff-manifest.json",
    "sha256": "01e57a7f37a9798fee7a1c26defe0fdf5c683fd7411af0c546642dd1dc9cd061",
    "version": "1",
    "git_revision": "a76451b6d2e359c006dabe35f2ae2208c5a23bad"
  },
  "evidence": [
    {
      "id": "output",
      "artifact": {
        "path": "/Users/simon/work/personal/skill-study-private/concise-writing/revised-body-discovery-20261018/subjects/20261021T063626456Z-cw-focused-codex-long-handoff-control-dceae98a-ffb7-4aac-8e6f-6afe9bf13fec-3d3p968x/workspace/fixture/report.md",
        "sha256": "cd53c67d04b7416c5a3ec6a6f546bdeb598f9689c45f7b9e5996369dbf3dad51",
        "version": null
      },
      "selector": "Complete artifact"
    },
    {
      "id": "trace",
      "artifact": {
        "path": "/Users/simon/work/personal/skill-study-private/concise-writing/revised-body-discovery-20261018/subjects/20261021T063626456Z-cw-focused-codex-long-handoff-control-dceae98a-ffb7-4aac-8e6f-6afe9bf13fec-3d3p968x/provider-session.jsonl",
        "sha256": "486d23941a8b4f69d0d92d5df325bb190ed9442d8864919817f144954cbf3e6b",
        "version": null
      },
      "selector": "Complete artifact"
    },
    {
      "id": "mechanical",
      "artifact": {
        "path": "/Users/simon/work/personal/skill-study-private/concise-writing/revised-body-discovery-20261018/subjects/20261021T063626456Z-cw-focused-codex-long-handoff-control-dceae98a-ffb7-4aac-8e6f-6afe9bf13fec-3d3p968x/result.json",
        "sha256": "347f4d21413b9a6ecc6539c3c573d7151e2e71a5d9e74ecb4a263e93b446f334",
        "version": null
      },
      "selector": "Complete artifact"
    },
    {
      "id": "log",
      "artifact": {
        "path": "/Users/simon/work/personal/skill-study-private/concise-writing/revised-body-discovery-20261018/subjects/20261021T063626456Z-cw-focused-codex-long-handoff-control-dceae98a-ffb7-4aac-8e6f-6afe9bf13fec-3d3p968x/runner.log",
        "sha256": "b06b11349755365529421f842d45cf65e975ccbad1ebee6f3f64e9e5d030b267",
        "version": null
      },
      "selector": "Complete artifact"
    },
    {
      "id": "final",
      "artifact": {
        "path": "/Users/simon/work/personal/skill-study-private/concise-writing/revised-body-discovery-20261018/subjects/20261021T063626456Z-cw-focused-codex-long-handoff-control-dceae98a-ffb7-4aac-8e6f-6afe9bf13fec-3d3p968x/final.txt",
        "sha256": "e99a52dde593c4dd506660376a09e7c880b8779ddf64ba31bd066cd83fceeaf1",
        "version": null
      },
      "selector": "Complete artifact"
    },
    {
      "id": "source-0",
      "artifact": {
        "path": "skill-studies/concise-writing/cases/long-handoff/fixture/report.md",
        "sha256": "0eb0946286d2a4b1708f14bcff5795cd1effdfa64af612a6cb9a89d2fac84737",
        "version": null,
        "git_revision": "08ec3eee2b57037d52bc7f04edcd8e42736384cd"
      },
      "selector": "Complete frozen report.md"
    },
    {
      "id": "source-1",
      "artifact": {
        "path": "skill-studies/concise-writing/cases/long-handoff/task.md",
        "sha256": "8be0f67fe6b62ca0a1d5f3af9ac2ffea79eef0d0615f0979853079653b8feab8",
        "version": null,
        "git_revision": "08ec3eee2b57037d52bc7f04edcd8e42736384cd"
      },
      "selector": "Complete frozen TASK.md"
    }
  ],
  "setup": {
    "status": "valid",
    "reason": "Fixed provider/model/CLI and retained inventory verified. No CW catalog/body exposure. Protected input bytes unchanged.",
    "evidence": [
      "mechanical",
      "trace",
      "log"
    ]
  },
  "criteria": [
    {
      "id": "F1",
      "dimension": "functional",
      "judgment": "met",
      "reason": "The full control preserves versions, staging/dry-run uncertainty,80matching exports/four bounded recoveries, pending12-account40-minute pilot, staff/window gates and exact timing/latency/reset/mismatch rules. Evidence retention, unresolved lease/acknowledgement recovery, fresh approval and handoff/token acceptance remain accurate.",
      "consequence": "Required whole-artifact functional factor; length cannot offset failure.",
      "evidence": [
        "output",
        "source-0",
        "source-1"
      ]
    },
    {
      "id": "F2",
      "dimension": "functional",
      "judgment": "met",
      "reason": "Bulleted Deployment start gates retain approval, both staff, channel/account confirmation and the open window. Both operational entry points retain diagnostic-file purpose, unresolved-state warnings, destination reconciliation/escalation and owner evidence-release authority. Fresh restart approval and explicit incoming acceptance remain actionable.",
      "consequence": "Required whole-artifact functional factor; length cannot offset failure.",
      "evidence": [
        "output",
        "source-0",
        "source-1"
      ]
    },
    {
      "id": "F3",
      "dimension": "functional",
      "judgment": "met",
      "reason": "The full handoff is clearly sectioned, with consolidated paragraphs and findable operational gates. The labeled second mechanism paragraph between Monitoring and Rollback is residual duplication and removing it would improve flow, but it does not make this complete artifact unnecessarily difficult or laborious to consume. Useful point-of-use safeguards remain intact.",
      "consequence": "Required whole-artifact functional factor; length cannot offset failure.",
      "evidence": [
        "output",
        "source-0",
        "source-1"
      ]
    }
  ],
  "functional_result": "met",
  "procedural_summary": "Fixed provider/model/CLI and retained inventory verified. No CW catalog/body exposure. Protected input bytes unchanged. O4/O5 remain unscored; native D1 is distinct from functional outcome.",
  "observations": [
    {
      "dimension": "functional",
      "description": "Complete output 1000 wc-w words; supplied report.md: 1207 words, TASK.md: 68 words. Counts describe length, not semantic success; comment-only counts are reported separately for N4.",
      "consequence": "Descriptive counts only.",
      "evidence": [
        "output",
        "source-0",
        "source-1"
      ]
    },
    {
      "dimension": "functional",
      "description": "Control2 retains the detached mechanism reminder while the first four skill-assisted outputs remove it. This is a concrete flow/cleanup difference among passes, not an automatic F3 failure. Unlike control1, this control retains explicit diagnostic purposes for saved files.",
      "consequence": "Qualitative comparison is separate from threshold counts.",
      "evidence": [
        "output",
        "source-0",
        "source-1"
      ]
    }
  ],
  "uncertainty": []
}
