{
  "schema_version": "2",
  "record_kind": "execution result",
  "result_id": "codex-body-focused-01-document-addition-control-3-1-assessment",
  "assessed_at": "2026-10-21T07:07:05.666175+00:00",
  "run_id": "20261021T070609613Z-cw-focused-codex-document-addition-control-508d0e0c-d751-4d0c-9af4-34e55d5629ae-_wf0vrzi",
  "condition": "control",
  "assessor": {
    "name": "Codex active session",
    "method": "active session",
    "model": null,
    "session_id": null,
    "context": "Same Codex controller authored/reviewed exposed development variants and directly judged complete outputs; no blind, held-out or independent assessor claim. Separate Opus review supplements this."
  },
  "manifest": {
    "path": "skill-studies/concise-writing/runs/revised-body-discovery-01/preparation/manifests/codex-document-addition-manifest.json",
    "sha256": "e3ed581ee504cd0bbfebd50d9fc674ab0ab0ac50a3e31a9de9b6e813469bc3ba",
    "version": "1",
    "git_revision": "5e634e99617bdba4a96be045df4ba4d73f630c73"
  },
  "evidence": [
    {
      "id": "output",
      "artifact": {
        "path": "/Users/simon/work/personal/skill-study-private/concise-writing/revised-body-discovery-20261018/subjects/20261021T070609613Z-cw-focused-codex-document-addition-control-508d0e0c-d751-4d0c-9af4-34e55d5629ae-_wf0vrzi/workspace/fixture/report.md",
        "sha256": "78f75c90ce2a401152fb9c1d31b1354c24552776d1f1ccb3a882f3f0962608ce",
        "version": null
      },
      "selector": "Complete artifact"
    },
    {
      "id": "trace",
      "artifact": {
        "path": "/Users/simon/work/personal/skill-study-private/concise-writing/revised-body-discovery-20261018/subjects/20261021T070609613Z-cw-focused-codex-document-addition-control-508d0e0c-d751-4d0c-9af4-34e55d5629ae-_wf0vrzi/provider-session.jsonl",
        "sha256": "d52f20bb1e274ae50b65688c1f8fe779ec538a3188d23ee7fb8086cdc54ce9a4",
        "version": null
      },
      "selector": "Complete artifact"
    },
    {
      "id": "mechanical",
      "artifact": {
        "path": "/Users/simon/work/personal/skill-study-private/concise-writing/revised-body-discovery-20261018/subjects/20261021T070609613Z-cw-focused-codex-document-addition-control-508d0e0c-d751-4d0c-9af4-34e55d5629ae-_wf0vrzi/result.json",
        "sha256": "051a884c66a54d0c18e9115ef40a3b941c66af5c1dc1e1ffc579cfff56f74fdd",
        "version": null
      },
      "selector": "Complete artifact"
    },
    {
      "id": "log",
      "artifact": {
        "path": "/Users/simon/work/personal/skill-study-private/concise-writing/revised-body-discovery-20261018/subjects/20261021T070609613Z-cw-focused-codex-document-addition-control-508d0e0c-d751-4d0c-9af4-34e55d5629ae-_wf0vrzi/runner.log",
        "sha256": "e8355aa515a9e477c7ae9c429eb54baa8651cd0a3a3550642b1640f47ab19b3f",
        "version": null
      },
      "selector": "Complete artifact"
    },
    {
      "id": "final",
      "artifact": {
        "path": "/Users/simon/work/personal/skill-study-private/concise-writing/revised-body-discovery-20261018/subjects/20261021T070609613Z-cw-focused-codex-document-addition-control-508d0e0c-d751-4d0c-9af4-34e55d5629ae-_wf0vrzi/final.txt",
        "sha256": "81d46a66ac01a9767ca75c04803a2de37e28de4da43d1eae586fcec3b1b3ef20",
        "version": null
      },
      "selector": "Complete artifact"
    },
    {
      "id": "source-0",
      "artifact": {
        "path": "skill-studies/concise-writing/cases/effective-briefing/fixture/report.md",
        "sha256": "93c23afd44aab52dfcd2bca53f3db0020a41f650d46d4c59a09595539dc72491",
        "version": null,
        "git_revision": "08ec3eee2b57037d52bc7f04edcd8e42736384cd"
      },
      "selector": "Complete frozen report.md"
    },
    {
      "id": "source-1",
      "artifact": {
        "path": "skill-studies/concise-writing/cases/document-addition/task.md",
        "sha256": "d625196b6cf438dfe556238803851c5b86ae7f2eb07acaa31ddceb5c6e9b8db0",
        "version": null,
        "git_revision": "08ec3eee2b57037d52bc7f04edcd8e42736384cd"
      },
      "selector": "Complete frozen TASK.md"
    },
    {
      "id": "source-2",
      "artifact": {
        "path": "skill-studies/concise-writing/cases/document-addition/new-notes.md",
        "sha256": "8ff2f1ece29e88f352aefe87506c1afcf7e3174849dd978d20ec7065e8da3b74",
        "version": null,
        "git_revision": "08ec3eee2b57037d52bc7f04edcd8e42736384cd"
      },
      "selector": "Complete frozen NEW-NOTES.md"
    }
  ],
  "setup": {
    "status": "valid",
    "reason": "Fixed provider/model/CLI and retained inventory verified. No CW catalog/body exposure. Protected input bytes unchanged.",
    "evidence": [
      "mechanical",
      "trace",
      "log"
    ]
  },
  "criteria": [
    {
      "id": "F1",
      "dimension": "functional",
      "judgment": "met",
      "reason": "Control E3 faithfully preserves the source observations, uncertainty, scale limits and invitation/default/timeout conditions. It incorporates the recorded fallback contact, precautionary affected-team pause and restricted query/result evidence, unaffected-team exception, Omar/Nia resumption and seven-day pause/investigation review.",
      "consequence": "Required whole-artifact functional factor; length cannot offset failure.",
      "evidence": [
        "output",
        "source-0",
        "source-1",
        "source-2"
      ]
    },
    {
      "id": "F2",
      "dimension": "functional",
      "judgment": "met",
      "reason": "The contact record joins the existing pre-invitation checks, while a dedicated incident section states pause, evidence, continued participation and both resumption gates. Review and separate expansion/default decisions remain connected and actionable.",
      "consequence": "Required whole-artifact functional factor; length cannot offset failure.",
      "evidence": [
        "output",
        "source-0",
        "source-1",
        "source-2"
      ]
    },
    {
      "id": "F3",
      "dimension": "functional",
      "judgment": "met",
      "reason": "The effective source sequence remains readable, with the resumption condition separated into its own paragraph and the incident branch placed before review. Required growth is integrated without competing old/new instructions.",
      "consequence": "Required whole-artifact functional factor; length cannot offset failure.",
      "evidence": [
        "output",
        "source-0",
        "source-1",
        "source-2"
      ]
    }
  ],
  "functional_result": "met",
  "procedural_summary": "Fixed provider/model/CLI and retained inventory verified. No CW catalog/body exposure. Protected input bytes unchanged. O4/O5 remain unscored; native D1 is distinct from functional outcome.",
  "observations": [
    {
      "dimension": "functional",
      "description": "Complete output 384 wc-w words; supplied report.md: 279 words, TASK.md: 58 words, NEW-NOTES.md: 166 words. Counts describe length, not semantic success; comment-only counts are reported separately for N4.",
      "consequence": "Descriptive counts only.",
      "evidence": [
        "output",
        "source-0",
        "source-1",
        "source-2"
      ]
    },
    {
      "dimension": "functional",
      "description": "Control E3 closely resembles control2 and preserves explicit fallback recording. The control remains an effective source-like integration without CW; its pass cannot be credited to a body that was not available.",
      "consequence": "Qualitative comparison is separate from threshold counts.",
      "evidence": [
        "output",
        "source-0",
        "source-1",
        "source-2"
      ]
    }
  ],
  "uncertainty": []
}
